{
  "review_state_schema_version": 1,
  "engagement_id": "2026-06-08-8e46b1c8",
  "ai_draft_artifact": "visual-report-desktop-v2.html",
  "created_at": "2026-06-08T23:30:32Z",
  "updated_at": "2026-06-08T23:30:32Z",
  "device": "desktop",
  "findings": [
    {
      "f_ref": "category-navigation F-45",
      "status": "needs_review",
      "cluster": "category-navigation",
      "severity": "MEDIUM",
      "ethics_state": "",
      "verdict": "PARTIAL",
      "finding_title": "Category Cards Don't Match the Shop-by-Category Menu Taxonomy",
      "finding_title_override": null,
      "finding_body": "Your five homepage category cards and your 'Shop by Category' menu list different categories — the 'Electronics' card has no menu match, and Drivetrain, Cooling, Wheels, and Accessories are in the menu but missing from the cards. Shoppers using each path get two different pictures of how your catalog is organized.",
      "finding_body_override": null,
      "observation": "The five large category cards (Performance, Handling & Brakes, Interior, Exterior, Electronics) present themselves as the store's primary category map, but they do not line up with the \"Shop by Category\" menu, which lists Performance, Exterior, Interior, Handling, Drivetrain, Brakes, Cooling, Wheels, and Accessories. The \"Electronics\" card points to a category the top menu never offers, while Drivetrain, Cooling, Wheels, and Accessories exist in the menu but are invisible on the homepage. A shopper who navigates by the cards and a shopper who navigates by the menu are working from two different taxonomies.",
      "observation_override": null,
      "recommendation": "Reconcile the cards and the menu to one taxonomy: either add cards for the menu categories that are currently homepage-invisible (Drivetrain, Cooling, Wheels, Accessories) or fold \"Electronics\" into the menu so the two surfaces name the same set of collections and use matching anchor text.",
      "recommendation_override": null,
      "why_this_matters": "When the homepage cards and the navigation menu disagree on the category structure, shoppers cannot form a reliable mental model of how the catalog is organized, and the mismatched anchor text also dilutes the internal-linking signals that help category pages rank and pass authority.",
      "why_this_matters_override": null,
      "callout_title": "Category Cards Don't Match the Shop-by-Category Menu Taxonomy",
      "callout_title_override": null,
      "callout_body": "Make the homepage cards and the category menu list the same set of categories.",
      "callout_color": "#FACC15",
      "callout_slide_id": "desktop-section-1",
      "callout_position": {
        "x_pct": 74,
        "y_pct": 42.37,
        "w_pct": 22,
        "h_pct": 8,
        "anchor": "auto"
      },
      "callout_visible": true,
      "marker_id": "marker-category-navigation-f-45",
      "ai_suggested_marker_id": "marker-category-navigation-f-45-ai",
      "lint_violations": [],
      "hotspot_confidence": "exact-selector",
      "visual_evidence": {
        "type": "exact_element",
        "confidence": "high",
        "observed_anchor": {
          "baton_index": "e33",
          "selector_hint": "div (Electronics category card)",
          "text_quote": "Electronics"
        }
      },
      "review_notes": "",
      "tagged_for_ai_pass": false,
      "ai_pass_instruction": null,
      "reviewed_at": null,
      "reviewed_by": null,
      "raw": {
        "index": 1,
        "baton_index": "e33",
        "match_method": "e_index_lookup",
        "element": "`div` (Electronics category card) at e33 (y=544, height=302 CSS px)",
        "section": "subcategory-tiles"
      }
    },
    {
      "f_ref": "category-navigation F-46",
      "status": "needs_review",
      "cluster": "category-navigation",
      "severity": "MEDIUM",
      "ethics_state": "",
      "verdict": "FAIL",
      "finding_title": "Vehicle Selector Submit Is an Icon-Only Square With No Label",
      "finding_title_override": null,
      "finding_body": "After a shopper picks their Make, Model, Year, and Trim, the button that shows compatible parts is just a magnifying-glass icon with no words. It looks like a generic search box and duplicates the separate site search, so high-intent shoppers hesitate at the final step.",
      "finding_body_override": null,
      "observation": "The vehicle fitment tool, the primary way a shopper narrows this auto-parts catalog to their car, ends in a magnifying-glass icon with no text. After a visitor sets Make, Model, Year, and Trim, the action that returns their compatible parts looks like a generic search icon rather than a labeled commit button. The reused magnifying glass also visually duplicates the separate site-search box at the top of the page, so the two distinct actions (free-text search vs. run-my-fitment) read as the same control.",
      "observation_override": null,
      "recommendation": "Give the fitment submit control a visible text label such as \"Find Parts\" or \"Show My Parts\" instead of a bare magnifying glass, and style it distinctly from the top-of-page site-search icon so the two findability tools are not confused.",
      "recommendation_override": null,
      "why_this_matters": "Compatibility-driven catalogs live or die on the fitment flow; Baymard found only 35% of shoppers successfully find a compatible product when compatibility filtering is unclear. An unlabeled commit button at the end of a four-step selection is the exact friction point where a high-intent shopper hesitates and abandons.",
      "why_this_matters_override": null,
      "callout_title": "Vehicle Selector Submit Is an Icon-Only Square With No Label",
      "callout_title_override": null,
      "callout_body": "Give the button a clear text label like 'Find Parts' and style it differently from the site search.",
      "callout_color": "#FACC15",
      "callout_slide_id": "desktop-section-1",
      "callout_position": {
        "x_pct": 74,
        "y_pct": 20.519,
        "w_pct": 22,
        "h_pct": 8,
        "anchor": "auto"
      },
      "callout_visible": true,
      "marker_id": "marker-category-navigation-f-46",
      "ai_suggested_marker_id": "marker-category-navigation-f-46-ai",
      "lint_violations": [],
      "hotspot_confidence": "exact-selector",
      "visual_evidence": {
        "type": "exact_element",
        "confidence": "high",
        "observed_anchor": {
          "baton_index": "e117",
          "selector_hint": "button (fitment submit, magnifying-glass icon)",
          "text_quote": "Find parts"
        }
      },
      "review_notes": "",
      "tagged_for_ai_pass": false,
      "ai_pass_instruction": null,
      "reviewed_at": null,
      "reviewed_by": null,
      "raw": {
        "index": 2,
        "baton_index": "e117",
        "match_method": "e_index_lookup",
        "element": "`button` (fitment submit, magnifier icon) at e117 (y=308, height=59 CSS px)",
        "section": "fitment-guide"
      }
    },
    {
      "f_ref": "category-navigation F-52",
      "status": "needs_review",
      "cluster": "category-navigation",
      "severity": "MEDIUM",
      "ethics_state": "",
      "verdict": "PARTIAL",
      "finding_title": "Fitment Selector Floats in an Empty Black Band Above the Fold",
      "finding_title_override": null,
      "finding_body": "Your most valuable tool — the vehicle finder — sits alone in a big empty black band with lots of dead space around it, while the category cards that show what you sell are pushed down out of the prime view. The most-looked-at area of the page is mostly blank.",
      "finding_body_override": null,
      "observation": "The vehicle fitment selector is the single most valuable findability control on this page, but it is dropped into the middle of a large empty black band with nothing around it and a wide gap of dead space both above and below the dropdown row. The result is that the most attention-rich zone of the page — the area above the fold where 57% of viewing time is spent — is mostly empty, while the category cards that communicate what the store actually sells do not start until y=544.",
      "observation_override": null,
      "recommendation": "Tighten the empty band around the selector: add a short directive headline above the dropdowns (for example \"Find parts that fit your car\") and reduce the vertical dead space so the selector and the first row of category cards both occupy the above-fold zone instead of leaving it largely blank.",
      "recommendation_override": null,
      "why_this_matters": "Above-the-fold space is the most-attended real estate on the page; leaving it as an empty black band wastes the prime opportunity to orient a first-time visitor and pushes the breadth-signaling category cards into lower-attention territory, slowing the visitor's read of what the store carries.",
      "why_this_matters_override": null,
      "callout_title": "Fitment Selector Floats in an Empty Black Band Above the Fold",
      "callout_title_override": null,
      "callout_body": "Add a short directive headline above the finder and tighten the spacing so the finder and first category cards share the top screen.",
      "callout_color": "#FACC15",
      "callout_slide_id": "desktop-section-1",
      "callout_position": {
        "x_pct": 33.521,
        "y_pct": 20.519,
        "w_pct": 22,
        "h_pct": 8,
        "anchor": "auto"
      },
      "callout_visible": true,
      "marker_id": "marker-category-navigation-f-52",
      "ai_suggested_marker_id": "marker-category-navigation-f-52-ai",
      "lint_violations": [],
      "hotspot_confidence": "exact-selector",
      "visual_evidence": {
        "type": "proxy_element",
        "confidence": "medium",
        "observed_anchor": {
          "baton_index": "e86",
          "selector_hint": "select (Select Make, leftmost fitment dropdown)",
          "text_quote": "Select Make"
        },